{
  "schemaVersion": "2.1.0",
  "gameVersion": "16.20.1",
  "category": "position",
  "generatedAt": "2026-10-07T10:17:31Z",
  "assets": [
    {
      "id": "position_icon:top",
      "type": "position_icon",
      "category": "position",
      "refId": "top",
      "names": {
        "pt_BR": "Topo",
        "en_US": "Top"
      },
      "source": "cdragon",
      "sourceUrl": "https://raw.communitydragon.org/latest/plugins/rcp-fe-lol-static-assets/global/default/svg/position-top.svg",
      "fileName": "Rota_Top.svg",
      "width": 34,
      "height": 34,
      "format": "svg",
      "hasAlpha": true,
      "bytes": 362,
      "sha256": "9cdaec5ffc26e530bb4a7a1cc9192a7610b25be0f8fd366c3605c1afd360f916"
    },
    {
      "id": "position_icon:jungle",
      "type": "position_icon",
      "category": "position",
      "refId": "jungle",
      "names": {
        "pt_BR": "Selva",
        "en_US": "Jungle"
      },
      "source": "cdragon",
      "sourceUrl": "https://raw.communitydragon.org/latest/plugins/rcp-fe-lol-static-assets/global/default/svg/position-jungle.svg",
      "fileName": "Rota_Jungle.svg",
      "width": 34,
      "height": 34,
      "format": "svg",
      "hasAlpha": true,
      "bytes": 593,
      "sha256": "b5fc0cc5ce9225a85a621216df3e284942bfc49380da4fdf4bf1f4bff428ddda"
    },
    {
      "id": "position_icon:middle",
      "type": "position_icon",
      "category": "position",
      "refId": "middle",
      "names": {
        "pt_BR": "Meio",
        "en_US": "Middle"
      },
      "source": "cdragon",
      "sourceUrl": "https://raw.communitydragon.org/latest/plugins/rcp-fe-lol-static-assets/global/default/svg/position-middle.svg",
      "fileName": "Rota_Middle.svg",
      "width": 34,
      "height": 34,
      "format": "svg",
      "hasAlpha": true,
      "bytes": 376,
      "sha256": "df95d266bc4cafd94e25ba7cb49cc3b85f7c31f8a95f9d5e496affffa783c953"
    },
    {
      "id": "position_icon:bottom",
      "type": "position_icon",
      "category": "position",
      "refId": "bottom",
      "names": {
        "pt_BR": "Atirador",
        "en_US": "Bottom"
      },
      "source": "cdragon",
      "sourceUrl": "https://raw.communitydragon.org/latest/plugins/rcp-fe-lol-static-assets/global/default/svg/position-bottom.svg",
      "fileName": "Rota_Bottom.svg",
      "width": 34,
      "height": 34,
      "format": "svg",
      "hasAlpha": true,
      "bytes": 384,
      "sha256": "2ee0de0500e2336ac44227b8040f47f7321f3e5f72cbad740c225633985855b2"
    },
    {
      "id": "position_icon:utility",
      "type": "position_icon",
      "category": "position",
      "refId": "utility",
      "names": {
        "pt_BR": "Suporte",
        "en_US": "Support"
      },
      "source": "cdragon",
      "sourceUrl": "https://raw.communitydragon.org/latest/plugins/rcp-fe-lol-static-assets/global/default/svg/position-utility.svg",
      "fileName": "Rota_Support.svg",
      "width": 34,
      "height": 34,
      "format": "svg",
      "hasAlpha": true,
      "bytes": 354,
      "sha256": "fdbb740a56418806862ad70a49754141e06ab919ffc3a6ba97a0a3b987875e10"
    }
  ]
}
