{
  "schemaVersion": "2.1.0",
  "gameVersion": "16.17.1",
  "category": "champion",
  "championKey": 24,
  "generatedAt": "2026-09-04T00:00:00Z",
  "assetsBaseUrl": "https://assets.exemplo.invalido/lol",
  "assets": [
    {
      "id": "square:24",
      "type": "square",
      "category": "champion",
      "championKey": 24,
      "championId": "Jax",
      "names": {
        "pt_BR": "Jax",
        "en_US": "Jax"
      },
      "source": "ddragon",
      "sourceUrl": "https://ddragon.leagueoflegends.com/cdn/16.17.1/img/champion/Jax.png",
      "storageKey": "16.17.1/champion/Jax_square.png",
      "fileName": "Jax_square.png",
      "width": 128,
      "height": 128,
      "format": "png",
      "hasAlpha": false,
      "bytes": 27107,
      "sha256": "441e8d865d461bc338a2d2d5a2a09f6151bbfdb4795ec8b59e66ee8654eebcca"
    },
    {
      "id": "splash_centered:24000",
      "type": "splash_centered",
      "category": "champion",
      "championKey": 24,
      "championId": "Jax",
      "skinId": 24000,
      "skinNum": 0,
      "isBaseSkin": true,
      "names": {
        "pt_BR": "Jax"
      },
      "source": "ddragon",
      "sourceUrl": "https://ddragon.leagueoflegends.com/cdn/img/champion/centered/Jax_0.jpg",
      "storageKey": "16.17.1/champion/Jax_000_splash_centered.jpg",
      "fileName": "Jax_000_splash_centered.jpg",
      "width": 1280,
      "height": 720,
      "format": "jpeg",
      "hasAlpha": false,
      "bytes": 92299,
      "sha256": "4031427064845d620556e67d886d870bd380262f10794ffeca8b65d000b693b7"
    },
    {
      "id": "splash_wide:24000",
      "type": "splash_wide",
      "category": "champion",
      "championKey": 24,
      "championId": "Jax",
      "skinId": 24000,
      "skinNum": 0,
      "isBaseSkin": true,
      "names": {
        "pt_BR": "Jax"
      },
      "source": "ddragon",
      "sourceUrl": "https://ddragon.leagueoflegends.com/cdn/img/champion/splash/Jax_0.jpg",
      "storageKey": "16.17.1/champion/Jax_000_splash_wide.jpg",
      "fileName": "Jax_000_splash_wide.jpg",
      "width": 1215,
      "height": 717,
      "format": "jpeg",
      "hasAlpha": false,
      "bytes": 139824,
      "sha256": "914a2f28d170d9c7329bffa466b548388871723386beb5e49bc366ad3742bb96"
    },
    {
      "id": "loading:24000",
      "type": "loading",
      "category": "champion",
      "championKey": 24,
      "championId": "Jax",
      "skinId": 24000,
      "skinNum": 0,
      "isBaseSkin": true,
      "names": {
        "pt_BR": "Jax"
      },
      "source": "ddragon",
      "sourceUrl": "https://ddragon.leagueoflegends.com/cdn/img/champion/loading/Jax_0.jpg",
      "storageKey": "16.17.1/champion/Jax_000_loading.jpg",
      "fileName": "Jax_000_loading.jpg",
      "width": 308,
      "height": 560,
      "format": "jpeg",
      "hasAlpha": false,
      "bytes": 40380,
      "sha256": "c69e6e15b5c2854565a2a971e7b1c8396bd963457ead7e26f83fef4573e4e682"
    },
    {
      "id": "tile:24000",
      "type": "tile",
      "category": "champion",
      "championKey": 24,
      "championId": "Jax",
      "skinId": 24000,
      "skinNum": 0,
      "isBaseSkin": true,
      "names": {
        "pt_BR": "Jax"
      },
      "source": "ddragon",
      "sourceUrl": "https://ddragon.leagueoflegends.com/cdn/img/champion/tiles/Jax_0.jpg",
      "storageKey": "16.17.1/champion/Jax_000_tile.jpg",
      "fileName": "Jax_000_tile.jpg",
      "width": 380,
      "height": 380,
      "format": "jpeg",
      "hasAlpha": false,
      "bytes": 37153,
      "sha256": "d50b372b5365562263ae2cd166914b7e6a6fa1fc97964e7ec5eaa1daac493d67"
    },
    {
      "id": "splash_centered:24004",
      "type": "splash_centered",
      "category": "champion",
      "championKey": 24,
      "championId": "Jax",
      "skinId": 24004,
      "skinNum": 4,
      "isBaseSkin": false,
      "names": {
        "pt_BR": "PAX Jax"
      },
      "source": "ddragon",
      "sourceUrl": "https://ddragon.leagueoflegends.com/cdn/img/champion/centered/Jax_4.jpg",
      "storageKey": "16.17.1/champion/Jax_004_splash_centered.jpg",
      "fileName": "Jax_004_splash_centered.jpg",
      "width": 1280,
      "height": 720,
      "format": "jpeg",
      "hasAlpha": false,
      "bytes": 107801,
      "sha256": "f41f449d22b190e0e7b7f11c51fc5ad3f863b1550ac4d61899bfbab677e9e7d7"
    },
    {
      "id": "splash_wide:24004",
      "type": "splash_wide",
      "category": "champion",
      "championKey": 24,
      "championId": "Jax",
      "skinId": 24004,
      "skinNum": 4,
      "isBaseSkin": false,
      "names": {
        "pt_BR": "PAX Jax"
      },
      "source": "ddragon",
      "sourceUrl": "https://ddragon.leagueoflegends.com/cdn/img/champion/splash/Jax_4.jpg",
      "storageKey": "16.17.1/champion/Jax_004_splash_wide.jpg",
      "fileName": "Jax_004_splash_wide.jpg",
      "width": 1215,
      "height": 717,
      "format": "jpeg",
      "hasAlpha": false,
      "bytes": 140845,
      "sha256": "3e83b318239d5cc5a88e45a9c6abad4867c4fcae9c5524e36665747b9c7eba2f"
    },
    {
      "id": "loading:24004",
      "type": "loading",
      "category": "champion",
      "championKey": 24,
      "championId": "Jax",
      "skinId": 24004,
      "skinNum": 4,
      "isBaseSkin": false,
      "names": {
        "pt_BR": "PAX Jax"
      },
      "source": "ddragon",
      "sourceUrl": "https://ddragon.leagueoflegends.com/cdn/img/champion/loading/Jax_4.jpg",
      "storageKey": "16.17.1/champion/Jax_004_loading.jpg",
      "fileName": "Jax_004_loading.jpg",
      "width": 308,
      "height": 560,
      "format": "jpeg",
      "hasAlpha": false,
      "bytes": 40942,
      "sha256": "c0696e493f35d667367d8bc5b6fe0687359c593803dc2c8e09eb5459c82b9d99"
    },
    {
      "id": "tile:24004",
      "type": "tile",
      "category": "champion",
      "championKey": 24,
      "championId": "Jax",
      "skinId": 24004,
      "skinNum": 4,
      "isBaseSkin": false,
      "names": {
        "pt_BR": "PAX Jax"
      },
      "source": "ddragon",
      "sourceUrl": "https://ddragon.leagueoflegends.com/cdn/img/champion/tiles/Jax_4.jpg",
      "storageKey": "16.17.1/champion/Jax_004_tile.jpg",
      "fileName": "Jax_004_tile.jpg",
      "width": 380,
      "height": 380,
      "format": "jpeg",
      "hasAlpha": false,
      "bytes": 40037,
      "sha256": "e18f2656bd0c212009ff6ededd3c685548d6e8b1cf392b5f099a0718117aba3b"
    }
  ]
}
